{
  "type": "dvrk_console:stereo_display@1.0.0",
  "name": "dvrk_test",
  "dvrk_console_namespace": "console",
  "sinks": [
    "glimage"
  ],
  "stereo": {
    "stream": "unixfdsrc socket-path=/tmp/dvrk_test_stereo.sock do-timestamp=true ! video/x-raw,format=I420,width=1280,height=480,framerate=30/1",
    "eye_size": {
      "width": 640,
      "height": 480
    }
  },
  "extra_streams": {
    "monos": [
      "videotestsrc pattern=checkers-4 is-live=true ! video/x-raw,width=320,height=240,framerate=30/1"
    ],
    "scale": 0.3
  }
}
